{"checks":[{"bound":1e-07,"module":"m01","name":"max |integral pdf - 1| (14 cases)","passed":true,"value":5.70943292643733e-12},{"bound":1e-09,"module":"m01","name":"max |cdf(quantile(p)) - p|","passed":true,"value":4.107825191113079e-15},{"bound":[0.4963485162832989,0.5036514837167011],"module":"m02","name":"uniform mean within 4 se of 0.5","passed":true,"value":0.49873306067972334},{"bound":[0.9821114561800017,1.0178885438199983],"module":"m02","name":"normal variance within 4 se of 1","passed":true,"value":0.9906103517653909},{"bound":1.0,"module":"m02","name":"uniform in [0,1)","passed":true,"value":0.9999840329447767},{"bound":[0.08,0.12],"module":"m03","name":"se shrinks ~ 1/sqrt(n): se(100000)/se(1000) vs 0.1","passed":true,"value":0.09870011814503347},{"bound":[10.752170245780393,11.154616083553497],"module":"m03","name":"n=20000 mean within CI of n=100000 mean","passed":true,"value":11.086579925097645},{"bound":[0.91,0.99],"module":"m03","name":"empirical coverage of 95% CI of the mean (300 reps, n=500, truth ~ n=100000 mean)","passed":true,"value":0.96},{"bound":[0.94,0.96],"module":"m04","name":"credible interval average coverage over its own prior (n=20)","passed":true,"value":0.9523355633536589},{"bound":"informational","module":"m04","name":"credible interval coverage at fixed p=0.05 differs from 0.95 (not a confidence guarantee)","passed":true,"value":0.924516},{"bound":0.3333333333333333,"module":"m04","name":"beta-binomial posterior mean = (a0+k)/(a0+b0+n) (Beta(1,1), 3/10)","passed":true,"value":0.3333333333},{"bound":0.28,"module":"m04","name":"sequential flat-prior mean at n=200 near k/n","passed":true,"value":0.28217821782178215},{"bound":0.83,"module":"m05","name":"vectorized SES fit equals plain SES fit (alpha)","passed":true,"value":0.83},{"bound":[0.93,0.97],"module":"m05","name":"AR(1) 1-step 95% empirical coverage near nominal (2000 reps, se 0.005)","passed":true,"value":0.945},{"bound":"informational","module":"m05","name":"SES 12-step 95% coverage is reported honestly (misspecified for AR(1))","passed":true,"value":0.993},{"bound":[1000,0.3],"module":"m06","name":"dataset rows / bad rate","passed":true,"value":[1000,0.3]},{"bound":[600,150,250],"module":"m06","name":"split sizes 600/150/250","passed":true,"value":[600,150,250]},{"bound":0.7,"module":"m06","name":"test AUC above 0.7","passed":true,"value":0.7364571428571428},{"bound":0.01,"module":"m06","name":"Platt scaling does not worsen test log loss by more than 0.01","passed":true,"value":[0.543220201453067,0.5453339684809423]},{"bound":"<=","module":"m06","name":"expected cost at cost-optimal grid threshold <= cost at 0.5 (test)","passed":true,"value":[0.576,1.092]},{"bound":0.05,"module":"m06","name":"mean predicted prob near base rate on test (calibration in the large)","passed":true,"value":[0.2894606032536358,0.3]},{"bound":1e-06,"module":"m07","name":"HiGHS (highspy) vs scipy linprog profit, 5 front points","passed":true,"value":0.0},{"bound":true,"module":"m07","name":"front profit nondecreasing in epsilon","passed":true,"value":true},{"bound":true,"module":"m07","name":"front strictly increasing (no dominated epsilon points)","passed":true,"value":true},{"bound":1e-05,"module":"m07","name":"anchor profit at eps_max equals max-profit anchor","passed":true,"value":[4624.999999998999,4624.999999999]},{"bound":1e-10,"module":"m08","name":"closed-form first-order indices vs 3-D Gauss-Legendre quadrature (64^3)","passed":true,"value":5.551115123125783e-17},{"bound":1e-10,"module":"m08","name":"closed-form total indices vs quadrature","passed":true,"value":2.220446049250313e-16},{"bound":1e-08,"module":"m08","name":"closed-form variance vs quadrature","passed":true,"value":7.105427357601002e-15},{"bound":"S3=0, ST3>0","module":"m08","name":"S3 = 0 but ST3 > 0 (pure interaction x1-x3)","passed":true,"value":[0.0,0.2436836640621477]},{"bound":[0.31390519114781146,0.4424111447900409,0.0],"module":"m08","name":"N=16384 mean first-order estimates within 0.02 of analytic","passed":true,"value":[0.317277,0.440441,-0.001171]},{"bound":[0.5575888552099592,0.4424111447900409,0.2436836640621477],"module":"m08","name":"N=16384 mean total-order estimates within 0.02 of analytic","passed":true,"value":[0.562177,0.44165,0.242695]},{"bound":[0.31390519114781146,0.4424111447900409,0.0],"module":"m08","name":"SALib (cross-check only) within 0.03 of analytic","passed":true,"value":{"S1":[0.3142,0.4434,-0.0003],"ST":[0.5576,0.4422,0.2445]}},{"bound":0.0,"module":"m08","name":"OAT at x=(0,0,0) reports zero x3 effect although ST3 > 0","passed":true,"value":0.0},{"bound":0.68,"module":"m09","name":"interpretable model test AUC above 0.68","passed":true,"value":0.7235047619047619},{"bound":1e-12,"module":"m09","name":"hand-written scorer equals sklearn predict_proba","passed":true,"value":1.1102230246251565e-16},{"bound":true,"module":"m09","name":"every counterfactual returned satisfies the target","passed":true,"value":[true]},{"bound":8,"module":"m09","name":"8 applicants evaluated","passed":true,"value":8},{"bound":[1794.0,1795.0],"module":"m10","name":"NSW experimental difference in means (published DW value 1794.34)","passed":true,"value":1794.3423818501024},{"bound":[185,260,2490],"module":"m10","name":"NSW sample: 185 treated, 260 control; PSID 2490","passed":true,"value":[185,260,2490]},{"bound":true,"module":"m10","name":"propensity Newton fit finite on NSW+PSID","passed":true,"value":true},{"bound":"< -10000","module":"m10","name":"naive observational estimate strongly negative (LaLonde 1986 pattern)","passed":true,"value":-15204.777421490988},{"bound":1.0,"module":"m10","name":"synthetic gamma=0: mean naive within 0.15 of truth 1 (30 reps)","passed":true,"value":1.07805610418254},{"bound":"naive>2.5; ra,ipw ~ 1","module":"m10","name":"synthetic gamma=1: naive biased > 1.5, adjusted within 0.1 of 1","passed":true,"value":[3.123316766976017,1.0210589020691665,0.9971391147493159]},{"bound":0.001,"module":"m10","name":"from-scratch Newton propensity fit vs statsmodels Logit (max coefficient diff; ridge 1e-8)","passed":true,"value":1.237680571364308e-07}],"failures_recorded":[],"generated_at":"2026-10-11T00:00:00Z","schema_version":"v1","tags":{"checks":"DERIVED"}}